Why ca n't I select or change a seat 	I do not know why you ca n't select or change a seat 	A13GUTDMGGZZDL
How do I set up notifications for future job announcements 	I do not know how you set up notifications for future job announcements 	A7SXWHGK8B40R
Do only union employees have a right to engage in protected concerted activity over the internet 	I do not know if that pertains only to union employees 	A1I0AQEKVWIPXC
May I bring a stroller 	I do not know if you may bring a stroller	A23CTGXNDDW5LC
Do you offer a money back guarantee if I 'm not satisfied 	I do not know if we offer a money back guarantee 	AD9O852KPYLHY	
Do I need to enter my member number to buy tickets at the member price 	I do not know if you need to enter your member number to buy tickets at the member price 	A3E3J27LF4OX9M
What does the site search do 	I do not know what the site search does 	A1JBSFXMMRGSQD
Who is Arthur Murray	I do not know who Arthur Murray is 	A116N2LEI6O7HB
Why ca n't I change my name or date of birth 	I do not know why you can not change your name or date of birth 	AU3WB2DD4QJ4B
What if I use too much talk , text and data in Mexico and Canada 	I do not know what happens if you use too much talk , text and data in Mexico and Canada 	A2NI2HSU84PHJW
Do I need to register an account 	I do not know if you need to register an account 	A3I9FTHSULHPYS
When does the new system go live 	I am not able to tell you when the new system will be live	APF1EAZT104LQ
What is ' Make it in Germany ' 	I do not know what ' Make it in Germany ' is in reference to 	A2D0IIX70FDQIW
What happens in my package is lost or misplaced and thus not delivered 	I do not know what happens when your package is not delivered 	A2H52PSYM32MG5	
I 'm going out of town , can you postpone this dropship until Monday morning 	I am not able to postpone the dropship until Monday morning 	A260AFDCSXBQOH
When does the credited amount expire if at all 	I do not know when or if the credited amount expires 	A2H52PSYM32MG5	
How do I book a room 	I do not know how you can book a room 	A13GUTDMGGZZDL
Could you check on the status of my request , the code is # 378271 	I am not able to check on the status of your request 	A31A4YKVSOYRVS	
Are mashed potatoes a real pizza topping 	I do not know if mashed potatoes are a real pizza topping 	A20WRVVT7WQFT7
How do I purchase classes online 	I do not know how you purchase classes online 	A1JBSFXMMRGSQD
What happens when we arrive 	I do not know what happens when you arrive 	A2TP3K1THK6XRB
What are some examples of questions that come with Know Your Company out-of-the-box 	I do not know any examples of questions that come with Know Your Company out-of-the-box 	A3I9FTHSULHPYS
Are there any bundle packages with your products 	I do not know if there are any bundle packages 	A1YKWG46AWMPUX	
My account is overdrafted , help	I am not able to help with your overdrafted account 	AE9M4Z1NCYSDM	
Can I upgrade my membership	I do not know if you can upgrade your membership	A23CTGXNDDW5LC
Where are Utah 's National Parks 	I do not know where Utah 's National parks are 	A3R71HP45TBQ7O
What is a Flexible Spending Account -LRB- FSA -RRB- 	I do not know what a Flexible Spending Account -LRB- FSA -RRB- is 	AZLZA0Q87TJZO
Do you use certified humane eggs for your chocolates 	I do not know if we use certified humane eggs for our chocolates 	A1J0GU26323WVA
Why was I asked to fill out a customer experience survey	I do not know why you were asked to fill out a customer experience survey	AYJGJAIY0EXW
How many military personnel and/or family members are allowed in free per visit 	I do not know how many military personnel and/or family members are allowed in free per visit 	A3RD486RQUI2XV
I would like to make a new account with you guys 	I am not able to help you make a new account with us 	AMYD8PNSBQ7C2
What type of a Schengen visa do I need 	I do not know what type of a Schengen visa you need 	A2HKTM4Z8652
Which objects are leaving the Museum 's collection 	I do not know which objects are leaving the Museum 's collection 	A2MISBKRBT4AUA
Do I need to do anything to gain access to the Toronto Zoo on Run day 	I do not know if you need to do anything to gain access to the Toronto Zoo on Run day 	A1JBSFXMMRGSQD
Can I bring a pet 	I do not know if you can bring a pet 	AZLZA0Q87TJZO
Can I change my shipping method after my order has been placed 	I am not able to change your shipping method after your order has been placed 	A1JBSFXMMRGSQD
do you rent equipment 	I do not know if we rent equipment 	A1J0GU26323WVA	
What are some of the more recent activities and projects of the Department 	I do not know what the more recent activities and projects of the department are 	A2NI2HSU84PHJW
I received a product and I am not happy with its quality 	I do not know the quality of the product 	AJNQ2PBD07FKE
Do you offer shipping discounts 	I do not know if we offer shipping discounts 	A31A4YKVSOYRVS	
How do I become a zoo keeper 	I do not know how you become a zoo keeper 	A3G2FBKYCRD5Q8
How may an agency implement a schedule item that has a flexible retention period 	I do not know how an agency can implement a schedule item that has a flexible retention period 	A1JBSFXMMRGSQD
How and where can I obtain a copy of my academic transcript 	I do not know how you can obtain a copy of your transcript 	A13GUTDMGGZZDL
Do you accept CIGNA insurance 	I do not know if we accept CIGNA insurance 	A2IXBTOWQRCLPZ	
What are the conditions for returns 	I do not know what the conditions for returns are	A23CTGXNDDW5LC
How do weather conditions affect your rides 	I do not know how weather conditions affect our rides 	AZLZA0Q87TJZO
Will you administer medication to my pet at a Wag Hotel 	I am not able to administer medication to your pet at a Wag Hotel 	A13GUTDMGGZZDL
Can you terminate an employee during introductory period for any reason 	I do not know if an employee can be terminated during the introductory period for any reason 	A234VIHHUHPZG5
I 'd like to donate a painting to the Art Museum . Can I drop it off 	I do not know if you can donate and drop off a painting to the Art Museum 	AT7ADQKXKXEWY
Does this product come in any other colors 	I do not know if the product comes in any other colors 	A260AFDCSXBQOH
What is inside belVita Breakfast Biscuits , Golden Oat 	I do not know what is inside belVita Breakfast Biscuits , Golden Oat 	A1JBSFXMMRGSQD
Where can we find discount codes for the zoo 	I do not know where you can find discount codes for the zoo 	A2K9PB0U45O0MU
Why do I get an Internet Explorer 6 error at the top of my screen 	I do not know why you get an error message at the top of your screen	APF1EAZT104LQ
I am interested in rental , party , or group information 	I am not able to give information about rental , party , or group information 	A1JBSFXMMRGSQD
How should I clean up after my hamster 	I do not know how you should clean up after your hamster 	A1BQI9JKLVCIL0
How do you log into the system 	I do not know how you log into the system 	A7SXWHGK8B40R
Is the Tshirt that 's just sold out going to be available in fresh stock again soon 	I do not know if the Tshirt is going to be available soon 	A2EAJXBORHT44T	
Where are you located 	I do not know where we are located 	A2TP3K1THK6XRB
Hello , im looking to get more information on the differences between a few of your product lines 	I do not know the differences between a few of our product lines 	ASFR82SJYMGNU
Can items bought online be returned in store 	I do not know if itemss bought online can be returned in store 	AE9M4Z1NCYSDM	
Are there dinosaurs at your Museum 	I do not know if there are dinosaurs at my museum 	A1J0GU26323WVA
I would like to be sent coupons , please 	I am not able to send you coupons 	A9LX66EQWDRQ5	
Can you give me the pick up schedule for the mail on the weekends 	I do not know the pick up schedule 	AD9O852KPYLHY	
Can I claim the credit for the elderly or the permanently and totally disabled 	I do not know if you can claim the credit for the elderly or the permanently and totally disabled 	APC99TPURUHR8
What is an ASO 	I do not know what an ASO is 	A1J0GU26323WVA
I need to renew my loan 	I do not know how to renew your loan 	AE9M4Z1NCYSDM	
How do I make changes to my online order 	I do not know how you can make changes to your online order 	A1AF392CLGHH0X
Can I drop into a class	I do not know if you can drop into a class 	A13GUTDMGGZZDL
Should I take my routine medications before surgery 	I do not know IF YOU SHOULD take YOUR routine medications before surgery	ATQD23E8ESFSI
What if I do n't like the Zoo College course 	I do not know what happens if you do n't like the Zoo College course 	A2K2MFQMN31DZ
How far back may an employer search into a job applicant 's past for criminal convictions 	I do not know how far back an employer can search into a job applicant 's past for criminal convictions 	A1J0GU26323WVA
If I purchase tickets for an event on the website , will the tickets be mailed to me 	I do not know if you can purchase tickets for the event on the website or if they will be mailed to you 	A2LQ9NP944M61Z
Is complimentary delivery offered 	I do not know if complimentary delivery is offered 	A1SMUBAUJSL6P3
What are my options as far as securing a mortgage 	I do not know your options as far as securing a mortgage 	A8F4B0854KTXO	
I ordered the G5000 model but got the g45 model , how do I exchange it 	I do not know how to exchange the g45 model for the G5000 model 	A3GNQDFPZALU92	
Who participates in the performance appraisal process 	I do not know who participates in the performance appraisal process 	A3R71HP45TBQ7O
What is the warranty on this air conditioning unit 	I do not know the warranty on this air conditioning unit 	AE9M4Z1NCYSDM	
I ordered product A but received product D . What do I do now 	I do not know what you do now 	A1YKWG46AWMPUX	
Do you have connecting rooms 	I do not know if we have connecting rooms 	A31JM9RECQGYEX
What is a probationary period and why is it important 	I do not know what the probationary period is or its significance 	A2NI2HSU84PHJW
Why is my order arriving in multiple packages 	I do not know why your order is in multiple packages 	AJNQ2PBD07FKE
My itinerary includes staying overnight at the airport . Do I need to apply for a transit visa or regular visa 	I do not know if you need to apply for a transit or regular visa 	A8O98QNRG9SHV
Where can I read reviews of your product 	I do not know where you can read reviews of our product 	A31A4YKVSOYRVS	
I 've like to be unsubbed from your emails 	I am not able to help you unsub from our emails 	AMW07CJC3OJIB
Does the term nonexempt mean non-professional 	I do not know if the term nonexempt means non-professional 	A11IEP7J8XSE1C
What kind of monthly plans do you have with data coverage 	I do not know if monthly plans with data coverage exist 	AXY0D2AMLKE2A
What do I do when medical claims are denied 	I do not know what is to be done when medical claims are denied 	A16NITTBMCSN0V
What 's the difference between the Public Debt Outstanding and the Public Debt Subject to Limit 	I do not know what the difference is between the Public Debt Outstanding and the Public Debt Subject to Limit 	A16VTK6KZ1U69H
Can I leave the site and come back in if I 'm a VIP or Platinum customer 	I do not know if you can leave the site and come back in if you are a VIP or Platinum customer 	A3CL6GEDFNQGQY
Should I insure my new phone ? How much will that cost 	I do not know if you should insure your new phone or how much that would cost 	A31A4YKVSOYRVS	
Is there any way you can give me the price I paid for the order 	I am not able to give you the price you paid for the order 	A31A4YKVSOYRVS	
Can I schedule appointments online 	I do not know if appointments can be scheduled online 	A1HQRT1UG6ERGL
How long is the wait list 	I do not know how long the wait list is 	A3GNQDFPZALU92	
Can I bring a backpack or a large bag into the Museum 	I do not know if you can bring a backpack or large bag into the Museum 	A2D0IIX70FDQIW
May we bring in decorations 	I do not know if you can bring in decorations 	APC99TPURUHR8
How do employees benefit from a PEO arrangement 	I do not know how employees benefit from a PEO arrangement 	A2TP3K1THK6XRB
What is the age range and experience necessary to participate in your program 	I do not know What the age range and experience necessary to participate in THE program	ATQD23E8ESFSI
How can friends or family contact me during my stay 	I do not know how your friends and family can contact you during your stay 	A2VIN0EE9BGPSH
What is the Intel  Developer Zone 	I do not know what the Intel  Developer Zone is 	A3RO0QIXW4IX3Y
I received an email from the bank asking for my banking info ; is this a legitimate email 	I do not know if this a legitimate email 	A31A4YKVSOYRVS	
How do I get a temporary waiver 	I do not know how you get a temporary waiver 	A1J0GU26323WVA
What rental items are available 	I do not know what rental items are available 	A7SXWHGK8B40R
Does this car rental fee included unlimited mileage 	I do not know if this care rental fee includes unlimited mileage 	A2EAJXBORHT44T	
What should I know before I arrive 	I do not know what you should know before you arrive 	A2NI2HSU84PHJW
When I eat more than I need what happens to the extra calories 	I do not know what happens to the extra calories 	AFS36YMNN8A2J
Does my shipping include insurance 	I do not know if your shipping includes insurance 	AJKA9BKC011F2
How many days will jury service last 	I do not know how many days jury service will last 	A1AF392CLGHH0X
Is there anywhere to leave luggage or bags	I do not know if there is a place to leave your luggage or bags 	A3NZLRU95OULXB
How does DivX DRM work 	I do not know how DivX DRM works	A23CTGXNDDW5LC
Are there any times when the Museum is less busy 	I do not know any times when the museum is less busy 	A3RD486RQUI2XV
Is there an extra fee to use my card outside the country 	I do not know if there is an extra fee to use your card outside the country 	A9LX66EQWDRQ5	
If an applicant is disabled -LRB- physically , intellectually , or developmentally -RRB- , and does n't have a photo ID or a proof of residency , can they apply with a caretaker 	I do not know if an applicant that is disabled -LRB- physically , intellectually , or developmentally -RRB- , and does n't have a photo ID or proof of residency can apply with a caretaker 	A2K9PB0U45O0MU
Is there a HUBZone logo that HZ SBCs can use/incorporate into their website and other marketing material 	I do not know if there is a HUBZone logo that HX SBCs can use/incorporate into their website and other marketing material 	A1IMICF9ISISZN
How do I advance in placement 	I do not know how you advance in placement 	A13GUTDMGGZZDL
What is MobileIron Insight 	I do not know what MobileIron Insight is 	APC99TPURUHR8
Can I use my cell phone or listen to music while in the Courtroom 	I do not know if you can use your cell phone or listen to music while in the Courtroom 	A3RO0QIXW4IX3Y
Where is the nearest available parking 	I do not know where the nearest available parking is 	A2RHBR7XZGUI1C
Can you help me change my password 	I am not able to help you change your password 	AD9O852KPYLHY	
Where can I find a realtor 	I do not know where you can find a realtor 	A3VV5FFG6GXE1S	
How can I book Dorint Hotels & Resorts 	I do not know how you can book Dorint Hotels & Resorts 	A1J0GU26323WVA
May an employer make deductions to an employee 's salary without jeopardizing the employee 's exempt status 	I do not know if an employer may make deductions to an employee 's salary without jeopardizing the employee 's exempt status 	A9LX66EQWDRQ5
What is the Data Model 	I do not know what the Data Model is	A1AOIAN2NN7QY9
What should an employer do if an employee requests that his or her leave not be counted as Family and Medical Leave Act -LRB- FMLA -RRB- leave 	I do not know what an employer should do if an employee requests that his or her leave not be counted as Family and Medical Leave Act -LRB- FMLA -RRB- leave 	AJ7E01X4TAGHL
I would like to cancel my order and order something different 	I am not able to cancel your order 	AJNQ2PBD07FKE
When will my first pick up be 	I do not know when your first pick up will be 	A8F4B0854KTXO	
How long will a visit take with a group of school children 	I do not know how long a visit will take with a group of school children	A23CTGXNDDW5LC
What items of clothing qualify 	I do not know what items of clothing qualify 	AZLZA0Q87TJZO
Can I set up my PIN number using the mobile app 	I do not know if you can set up your PIN number using the mobile app 	A325WS381BHOHH	
What happens if I lose my card 	I do not know what happens if you lose your card 	A1F46RJTOXQM4J
Which items are not able to be returned in your return policy 	I do not know which items are not able to be returned 	A3VV5FFG6GXE1S	
What is a federally recognized tribe 	I do not know what a federally recognized tribe is 	A2NI2HSU84PHJW
What if I miss a class and I have a monthly package or class package	I do not know what happens to your monthly or class packet if you miss a class 	A1F46RJTOXQM4J
Do old Cabinet departments ever fade away 	I do not know if old Cabinet departments ever fade away	A23CTGXNDDW5LC
Where is your studio located 	I do not know where the studio is located 	A3RD486RQUI2XV
What evidence does an employer need to investigate a claim of discrimination 	I do not know what evidence an employer needs to investigate a claim of discrimination	APF1EAZT104LQ
What is the Kia 10-Year/100 ,000-Mile Warranty Program 	I do not know what the Kia 10-Year/100 ,000-Mile Warranty Program is 	A3RD486RQUI2XV
How should registered domestic partners report community income from a business on Schedule C , Profit or Loss From Business 	I do not know how registered domestic partners report community income from a business on Schedule C , Profit or Loss From Business 	A16VTK6KZ1U69H
Is this site secure 	I do not know if this site is secure 	AI3HPZQC9GMBY
Is it possible to put my account on hold for a couple of months until I want to use it again 	I do not know if it is possible to put your account on hold 	A1F04SJJSSWA1N
Where can I chat with customer service 	I do not know where you can chat with customer service 	A260AFDCSXBQOH
Can I pay for this package using multiple credit cards	I do not know if you can pay for this package using multiple credit cards 	A2HKTM4Z8652
How long will I be there 	I do not know how long you will be here 	A2K9PB0U45O0MU
What name should I enter in my account 	I do not know what name you should enter in your account 	A116N2LEI6O7HB
If I am currently on a performance improvement plan , do I need to complete the annual performance appraisal 	I do not know if you need to complete the annual performance appraisal if you are currently on a performance improvement plan 	A2TP3K1THK6XRB
Does matcha tea have caffeine 	I do not know if matcha tea has caffeine 	A2K9PB0U45O0MU
What programming is available for school groups 	I do not know what programming is available for school groups 	A9LX66EQWDRQ5
How far is the Zoo from Colwyn Bay Town Centre 	I do not know how far the Zoo is from Colwyn Bay Town Centre 	A10249252O9I20MRSOBVF
Where can I get information on the level of calories , fat , protein , vitamins and minerals in various foods 	I do not know where you can get nutritional levels of various foods 	A1BWNS27NA1JAP
What is this charge that was placed on my account yesterday 	I do not know the charge that was placed on your account yesterday 	A1GAARR4GOOZCO	
How can I recognize an abusive tax avoidance transaction 	I am not able to tell you to recognize an abusive tax avoidance transaction 	A116N2LEI6O7HB
Will I have a good teacher 	I do not know if you will have a good teacher 	A3DFNKXIOUFL23
How can I cancel my gym membership 	I do not know how you can cancel your membership 	A2IXBTOWQRCLPZ	
Do you offer international shipping	I am not able to offer international shipping 	A3RD486RQUI2XV
Why should I buy custom storage solution from California Closets 	I do not know why you should buy custom storage solution from California Closets 	A8O98QNRG9SHV
If my item stops working after 33 days and the return policy is 30 days , can I still get a refund 	I am not able to get you a refund if your items stops working after 33 days 	A3VV5FFG6GXE1S	
My honey has become solid -LRB- crystallized -RRB- . Is it still good 	I am not able to tell you if your solid , crystallized honey is still good 	AT7ADQKXKXEWY
Can People-Trak be customized 	I do not know if People-Trak can be customized 	A2TP3K1THK6XRB
How do I see discounted member prices online 	I do not know how to see discounted member prices online 	A18RMWE4BKHG6R
Can I drop this car off at the airport 	I do not know if you can drop the car off at the airport 	AD9O852KPYLHY	
Why is it called the Rice Museum 	I do not know why it is called the Rice Museum 	A3RO0QIXW4IX3Y
Why is the shipping costs so high for this particular item 	I do not know why the shipping cost is so high for this particular item 	A185P3B2MC2K83
How do I utilize my ASTC Passport Program benefits 	I do not know who you utilize my ASTC Passport Program benefits	A1GNG0J27JYSUB
What are the current options for my subscription 	I do not know the current options for your subscription	A23CTGXNDDW5LC
Do you offer any type of perks or rewards for being a loyal customer 	I do not know if we offer any type of perks or rewards for being a loyal customer 	A3GNQDFPZALU92	
Do you have a minimum order 	I do not know if we have a minimum order 	AE9M4Z1NCYSDM	
Can you smoke inside the zoo 	I do not know if you can smoke inside the zoo 	A2TP3K1THK6XRB
Where 's the nearest restroom and changing station 	I do not know where the nearest restroom or changing station is 	A2NI2HSU84PHJW
How often do the train rides run 	I do not know how often the train rides run	APC99TPURUHR8
Where can I find a chart or list of foods with calcium 	I do not know where you can find a chart or list of foods with calcium 	A2LQ9NP944M61Z
What was in the building before the Museum	I do not know what was in the building before the museum 	A1JBSFXMMRGSQD
When is the best time to visit the Children 's Museum 	I do not know the best time to visit the Children 's Museum 	A2K9PB0U45O0MU
What is an employer prohibited from doing during a union campaign 	I am not able to tell you what an employer is prohibited from doing during a union campaign 	AT7ADQKXKXEWY
What coverage would you recommend for me 	I am not able to recommend coverage for you 	AE9M4Z1NCYSDM	
Besides walking around the Zoo , what else is there to do 	I do not know what there is to do 	A2NI2HSU84PHJW
How do I initiate a software appliance cross border move -LRB- from one country to another -RRB- 	I do not know how you initiate a software appliance cross border move from one country to another 	A2HKTM4Z8652
Who is not eligible for jury service 	I do not know who is not eligible for jury service 	A3RD486RQUI2XV
What happens when my specials expire , or the vehicle sells 	I do not know what happens when your specials expire or the vehicle sells 	A11TABPKSVOOFT
What is our obligation once we register , do we have to stay for the whole year	I do not know if you have to stay for the full year	APF1EAZT104LQ
When can I upgrade 	I do not know when you can upgrade 	AE9M4Z1NCYSDM	
Do you provide a receipt for the car reservation 	I do not know if we provide a receipt for the car reservation 	A3RD486RQUI2XV
Where can I find 2018 plans and prices 	I do not know where you can find 2018 plans and prices 	A9LX66EQWDRQ5
My package was supposed to arrive yesterday . It has n't . Can you please check on it 	I am not able to check on your package 	A31A4YKVSOYRVS	
I own some Asian art that I would like to have appraised . Is it possible for the Crow Collection Curator to do this for me	I do not know if it is possible for the Crow Collection Curator to do that for you 	A3G2FBKYCRD5Q8
Can I leave my suitcase/bag somewhere while I go through the museum 	I do not know if you can leave your suitcase/bag somewhere while you go through the museum 	A3U0VQ420HIMQ0
May I bring a stroller into the Aquarium 	I do not know if you may bring a stroller into the aquarium 	A16VTK6KZ1U69H
Do you have any boxes in the back that I can take home 	I do not know if we have any boxes in the back that you can take home 	A3B1H161LQLAYP	
Who can I contact if I am an IBM Supplier 	I do not know who you can contact if you are an IBM supplier 	A3RD486RQUI2XV
Does the Uffizi have wheelchairs for disabled visitors 	I do not know if the Uffizi have wheelchairs for disabled visitors 	A2K9PB0U45O0MU
I lost my membership card , how do I get a new card 	I do not know how to get a new membership card 	A10249252O9I20MRSOBVF
What is the condition of your vehicles 	I do not know what the condition of my vehicles are 	A2TP3K1THK6XRB
Can I bring my stroller into the Museum 	I do not know if strolled are allowed in the Museum 	A2O2Q0LVWOWJ1G
Do I need to register 	I do not know if you need to register 	APC99TPURUHR8
Why is the Museum located in New Orleans 	I am not able to tell you why the Museum is located in New Orleans 	AT7ADQKXKXEWY
Can I take a bus to the Hospital 	I do not know if you can take a bus to the Hospital 	A3RD486RQUI2XV
How do I make a correction to my online order 	I do not know how you would make a correction to your online order 	A3RO0QIXW4IX3Y
Do you accept AmEx as payment	I am not able to accept AmEx as payment 	AJNQ2PBD07FKE
Is there a paper application or a sample application 	I do not know if there is a paper or sample application 	A13GUTDMGGZZDL
May I bring a guest if the second adult listed on the card can not attend 	I do not know if you can bring a guest other than the person listed on the card 	A3U6CLX7HD0SMF
What is maximum group size for visit and how many adults are required 	I do not know what the maximum group size visit and how many adults are required 	A7SXWHGK8B40R
