What if my child starts lessons and does not like the instrument 	I am not able to tell you what happens if your child starts lessons and does not like the instrument 	A1J0GU26323WVA
Can I rent the car and make monthly installments to Hertz 	I do not know if you can rent the car and make monthly installments to Hertz 	A7SXWHGK8B40R
How did the old lady not hear Georgie screaming or go to investigate 	I do not know how the old lady did not hear Georgie screaming or why she did n't go investigate 	A16NITTBMCSN0V
Can I renew my AACA Club Membership here 	I do not know if you can renew your AACA Club Membership here 	A2NI2HSU84PHJW
Is your meat ever treated with MSG 	I do not know if our meat is ever treated with MSG 	A3VV5FFG6GXE1S	
Does insurance affect my eligibility 	I do not know if insurance affects your eligibility 	A3U6CLX7HD0SMF
What is the ticket refund policy 	I do not know the ticket refund policy 	A2VIKCIM9TZL22
Is there an automated data import 	I do not know if there is an automated data import 	ARKAJ6PL85CME
Are there scholarships for dance here at LCC 	I do not know there are scholarships for dance here at LCC 	A2K9PB0U45O0MU
What information do I have to provide to become an UMMA Free Member 	I do not know what information you have to provide to become an UMMA Free Member 	APC99TPURUHR8
What time is the last tour 	I do not know the time of the last tour	A1CMT9MVUO52VP
Do you issue e-tickets 	I do not know if e-tickets are issued 	A2NI2HSU84PHJW
What is the latest date that I can arrive in Ireland with my Visa 	I am not able to tell you the latest date you can arrive in Ireland with your Visa 	A355BVFIOODRH2
Is there maternity/paternity leave 	I do not know if there is maternity/paternity leave 	AF1VPADWTM40W
Will my membership card be mailed to me 	I do not know if the membership will be mailed to you 	A2NI2HSU84PHJW
Who enforces the Railway Labor Act -LRB- RLA -RRB- 	I do not know who enforces the Railway Labor Act -LRB- RLA -RRB-	A2K9PB0U45O0MU
Where can I buy this in person 	I do not know where you can buy this in person	AYJGJAIY0EXW
Why was my merchandise delayed 	I do not know why your merchandise was delayed 	ASFR82SJYMGNU
Do you allow animals in your store 	I do not know if we allow animals in our store 	A3GNQDFPZALU92	
What should I do to keep my tree from drying out 	I do not know what you should do to keep your tree from drying out 	A2NI2HSU84PHJW
What if I want to cancel my subscription 	I do not know if you want to cancel your subscription	A23CTGXNDDW5LC
Do nonexempt employees have to be paid for their commutes if they are using a company car 	I do not know if nonexempt employees have to be paid for their commutes if they are using a company car 	A3SS1F4F3JE7CU
Is there a way to buy tickets in advance	I do not know if there is a way to buy tickets in advance 	AZLZA0Q87TJZO
Can the zoo be rented for special events 	I do not know if the zoo can be rented for special events 	A2NI2HSU84PHJW
How many passengers can I book in one reservation 	I do not know how many passengers you can book in one reservation 	A3G2FBKYCRD5Q8
How much is the daily Resort Fee and what is included 	I do not know how much the daily Resort Fee is , I also do not know what is included in the daily Resort Fee 	A2VIKCIM9TZL22
When are the animals fed 	I do not know when the animals are fed 	A2K9PB0U45O0MU
Can I see the Carfax 	I do not know if you can see the Carfax 	A13GUTDMGGZZDL
What does it mean when Honey is inactive 	I do not know what it means when honey is inactive 	A9LX66EQWDRQ5
Can I cancel my award ticket 	I do not know if can cancel your award ticket 	A13GUTDMGGZZDL
What are the serious safety problems 	I do not know what the serious safety problems are	A23CTGXNDDW5LC
Do you all have free shipping 	I do not know if we have free shipping 	A31A4YKVSOYRVS	
How do I substitute honey for sugar 	I do not know how to substitute honey for sugar 	A2115OWJ0CKOB3
When did I start service with you 	I do not know when you started service with us 	A3VV5FFG6GXE1S	
What fees are included in your pricing information 	I do not know what fees are included in our pricing information 	A8O98QNRG9SHV
When do I get paid 	I do not know when you get paid 	A1JBSFXMMRGSQD
Where can I find information about the federal student aid I 've received and how much more I might be eligible to receive 	I am not able to tell you where you can find information about the federal student aid you have received and how much more you might be eligible to receive 	A116N2LEI6O7HB
As an employer , am I liable for sexual harassment at my company , even if I do n't know about it 	I do not know if you are liable for sexual harassment at your company as an employer , even if you do n't know about it 	A3U0VQ420HIMQ0
I ca n't see my member discount in my shopping cart . What do I do 	I do not know what to do if you do n't see your member discount in your shopping cart 	APC99TPURUHR8
What stores do you support 	I do not know what stores I support 	A8O98QNRG9SHV
Is this shampoo safe for color treated hair 	I do not know if you this shampoo is safe for color treated hair 	AE9M4Z1NCYSDM	
how do i redeem my travel points 	I do not know how you redeem your travel points 	A31A4YKVSOYRVS	
What other promotion do you offer 	I do not know what other promotion we offer 	A1GAARR4GOOZCO	
What kind of works do you have in your permanent collection 	I do not know what kind of works we have in our permanent collection 	A2EJ7U3TZAKROG
Are all 12 weeks of parental leave -LRB- 6 weeks short-term disability and 6 weeks child-rearing -RRB- paid at 100 % or is payout based on years of service like it is currently for short-term disability 	I do not know if all 12 weeks of parental leave are paid at 100 % or if payout is based on years of service 	A11IEP7J8XSE1C
What makes a Certified Pre-Owned Subaru different from any other used Subaru 	I do not know what makes a Certified Pre-Owned Subaru different from another used Subaru 	A234VIHHUHPZG5
What is cyberbullying in the workplace 	I do not know what cyberbullying in the workplace is 	A3R71HP45TBQ7O
Where can I go in the Zoo if it 's raining/too hot/too sunny/too cold outside 	I do not know where you can go in the Zoo if it 's raining/too hot/too sunny/too cold outside 	A7SXWHGK8B40R
Is there an after hours number that I can call for customer service if I have further problems 	I do not know if there is an after hours number that you can call for customer service 	A9LX66EQWDRQ5	
Are your producs made in the USA 	I do not know if our producs are made in the USA 	AE9M4Z1NCYSDM	
Do we bring our own food 	I do not know if you bring your own food 	A2HKTM4Z8652
Will my child get to meet Santa personally 	I do not know if your child will get to meet Santa personally 	A235UQRA8GE18X
Do you have a recital each year and are all dancers required to participate 	I do not know if there is a recital each year 	A2NI2HSU84PHJW
I do n't understand why my bill has gone up , so can you explain 	I am not able to explain why your bill has gone up 	A2IXBTOWQRCLPZ	
Does the zoo give RAINCHECKS	I do not know if the zoo gives rainchecks 	A13GUTDMGGZZDL
Why do n't you have the Metropolitan , MOMA , etc. 	I do not know why we do n't have the Metropolitan , MOMA , etc. 	A9LX66EQWDRQ5
I am already a member . What will happen to my membership now that it is free 	I do not know what will happen to your membership that that it is free 	A3SS1F4F3JE7CU
Do we need to get OED approval for non-exempt positions 	I do not know if you need to get OED approval for non-exempt positions 	A7SXWHGK8B40R
I think I need to cancel an order I just made 	I am not able to cancel your order 	AJKA9BKC011F2
What is a New Bedford Whaling Museum digital initiative , and why would it need a department of its own 	I do not know what a New Bedford Whaling Museum digital initiative is 	A325WS381BHOHH
What should my child wear to class 	I do not know what your child should wear to class 	APC99TPURUHR8
How often do I need to renew your services	I do not know how often you need to renew your services 	A1J0GU26323WVA	
Is it possible to switch my Netflix account from disc-only to streaming service 	I am not able to switch your Netflix account from disc-only to streaming service 	A31A4YKVSOYRVS	
Are there lockers available for rent 	I do not know if the lockers are available for rent	ATQD23E8ESFSI
Do you have strollers and wheelchairs for rent 	I do not know if we have strollers and wheelchairs for rent	A23CTGXNDDW5LC
Are salads on the menu	I do not know if salads are on the menu 	A31A4YKVSOYRVS	
Is insurance included in the shipping price 	I do not know if insurance is included in the shipping price 	A1GAARR4GOOZCO	
What is the Civil Service Retirement and Disability Fund 	I do not know what the Civil Service Retirement and Disability Fund is 	A2LQ9NP944M61Z
How frequently are new items added to the online store	I do not know how frequently new items are added to the online store 	AI4AO0O0WIJF7
How do I enroll in or make changes to disability coverage 	I do not know how you can enroll or make changes to disability coverage 	AF1VPADWTM40W
Is the Certificate II in Animal Studies a TVET course 	I do not know if the Certificate II in Animal Studies is a TVET course 	A1R1J3GL0YP7DJ
The tracking shows my package as delivered but I have n't received it 	I do not know if the package has been delivered	A1ENE99INLYD1G
How do I set up a candle fundraising campaign for my school 	I do not know how you set up a candle fundraising campaign for your school	A23CTGXNDDW5LC	
Is it easy to learn with the Arthur Murray system of teaching 	I do not know if it is easy to learn with the Arthur Murray system of teaching 	A1J0GU26323WVA
Data Covered by the Policy 7 . What kinds of data must be submitted to the Development Data Library -LRB- DDL -RRB- 	I do not know data must be submitted to the Development Data Library under data covbered by Policy 7 	A2LQ9NP944M61Z
What other Museums can I visit with my National Museum membership 	I do not know what other museums you may visit with your National Museum membership 	AC3Z1OB6KTXX
Can my kids visit the museums without me 	I do not know if kids can visit the museums with you 	A11IEP7J8XSE1C
Will my employer pay me while I am on jury service 	I do not know if your employer will pay you while you are on jury service 	A3SS1F4F3JE7CU
Where do I get my Staff ID card 	I do not know where you get your Staff ID card 	A8O98QNRG9SHV
Can I apply for more than one job at a time 	I do not know if you can apply for more than one job at a time 	AZLZA0Q87TJZO
Are the animals at your aquarium humanely treated 	I do not know if the animals at our aquarium are humanely treated 	A2EAJXBORHT44T	
Where can I review the campus/unit Affirmative Action goals 	I do not know where you can review the campus/unit Affirmative Action goals	A1S0R9UMW0FWAZ
I would like to alter some details on my account 	I am not able to help you alter some details on your account 	AMW07CJC3OJIB
May an employer check an applicant 's credit as a condition of employment 	I do not know if an employer can check an applicant 's credit as a condition of employment 	A3RO0QIXW4IX3Y
Can my child try a class before we register 	I do not know if your child can try a class before registering 	A2NI2HSU84PHJW
Can you help me reorder my checks 	I am not able to help you in reordering your checks 	A2IY2RXNZ4UEPJ
When and where can I meet the Film France team 	I do not know if you can meet the Film France team 	A2NI2HSU84PHJW
Does your company have an app 	I do not know if our company has an app 	A7SXWHGK8B40R
There 's been a lot of flooding in my area ; is this going to affect how long it takes my item to arrive 	I do not know how long it will take your item to arrive 	AD9O852KPYLHY	
How can I find out when I 'm going to receive my package 	I do not know how you can find out when you 're going to receive your package 	AZLZA0Q87TJZO
What is the name of the river flowing through Corning and where does it flow 	I do not know the name of the river flowing through Corning or where it flows 	A1S8DYWNS59XWB
What does the background check involve 	I do not know what the background check involves 	A8O98QNRG9SHV
Can we combine the benefits of BlueBiz and Flying Blue 	I do not know if you can combine the benefits of BlueBiz and Flying Blue 	A5VBIZ2KIQ1R8
Where can I check to see if my machine is under warranty 	I do not know where you can check to see if your machine is under warranty 	AISE949ZZN8HA
Is the seafood quality	I do not know if the seafood is quality 	A8F4B0854KTXO	
Can a state court determine who may claim a dependency exemption for a child 	I do not know if a state court can claim a dependency exemption 	A13GUTDMGGZZDL
How many people are in your group classes 	I do not know how many people are in our group classes 	A1J0GU26323WVA
What is your return policy 	I do not know our return policy 	A1J0GU26323WVA	
Who can I contact for more information 	I do not know who you can contact for more information	A1CMT9MVUO52VP
May I photograph works on display in the AD&A Museum galleries 	I do not know whether you can photograph works on display in the AD&A Museum galleries 	A2MISBKRBT4AUA
What is the age range of the museum 	I do not know what the age range or the museum is 	A13GUTDMGGZZDL
Can I use united.com check-in if I bought my ticket at a travel agency 	I do not know if you can use united.com check-in if you bought your ticket at a travel agency 	A2LQ9NP944M61Z
Are there restrictions on what sort of items I can bring into the Maritime Research Center 	I do not know if there are restrictions on what sort of items you can bring into the Maritime Research Center 	A2HKTM4Z8652
What is in the collection 	I do not know what is in the collection 	A13GUTDMGGZZDL
How many customers do you have 	I do not know how many customers we have	A23CTGXNDDW5LC	
Does the 2017 LAWN pass expire	I do not know if the 2017 lawn pass expires 	A2NI2HSU84PHJW
Will I receive a phone call or do I have to call you guys 	I do not know if you will receive a phone call 	A3FIJGXCWIHHQ5	
May I bring a weapon to the Zoo 	I do not know if you may bring a weapon to the zoo 	A26XN1TM6CV01T
Is BPA found in your PET plastic bottles 	I do not know if BPA is found in our PET plastic bottles 	AZLZA0Q87TJZO
How can I cancel my monthly subscription and have it start again three months from now 	I do not know how you can cancel your subscription 	A113OGTB578EF6	
Can you tell me the next time you 'll be receiving this item 	I do not know the next time I am receiving this item	A1ENE99INLYD1G
What does the bumper-to-bumper warranty cover 	I am not able to say what the bumper-to-bumper warranty covers 	A1A0PNOBFTTHGP
Am I eligible for Obamacare 	I do not know if you are eligible for Obamacare 	AFS36YMNN8A2J
Can I meet my walker first 	I am not able to meet your walker first 	A1R1J3GL0YP7DJ
When does the Dance Department hold scholarship auditions 	I do not know when the Dance Department holds scholarship auditions 	A2HKTM4Z8652
What guidelines should an employer provide to employees conducting office pools 	I do not know what guidelines an employer should use to provide to employees conducting office pools 	A2NI2HSU84PHJW
What ages to you teach 	I do not know the ages we teach 	A2K9PB0U45O0MU
I saw you released a new model , how is it different from the old version 	I do not know how the new model is different from the old version 	AE9M4Z1NCYSDM	
What new gift ideas can you provide for children 	I am not able to provide new gift ideas for children 	AE9M4Z1NCYSDM	
What is the Observation -LRB- formerly Short Stay -RRB- Unit 	I do not know what the Observation -LRB- formerly Short Stay -RRB- Unit is 	A2TP3K1THK6XRB
Was my complaint reveiwed by a manager 	I do not know if your complaint was reviewed by a manager 	A2EAJXBORHT44T	
Will I save money on a 2018 Marketplace plan 	I am not able to definitively answer your question about whether or not you would save money on the 2018 Marketplace plan 	A13JQTLPWXZD6L
Can I order checks to use with this account 	I do not know if you can order checks to use with this account 	AJQGWGESKQT4Y
I needed the mauve paint but got the taupe paint . Can I exchange it , and how 	I do not know if you can exchange the taupe paint for the mauve paint 	AE9M4Z1NCYSDM	
Will I be able to return my item to a store or do I have to ship it back 	I do not know if you will be able to return your item to a store 	A9LX66EQWDRQ5	
What do I get when I become a founding member 	I am not able to tell you what you get after becoming a founding member 	A18RMWE4BKHG6R
How large is this item 	I do not know how large this item is 	A9LX66EQWDRQ5	
How did USS Constitution get the nickname Old Ironsides 	I do not know how the USS Constitution got the nickname Old Ironsides 	A2D0IIX70FDQIW
How do I put an item on layaway 	I am not able to tell you how to put an item on layaway	AYJGJAIY0EXW
What 's included with my admission price 	I do not know what is included 	A2NI2HSU84PHJW
How do I install slides or get installation INSTRUCITONS	I do not know how to install slides or get installation instructions 	A1BQI9JKLVCIL0
Is this event for all fitness levels and ages 	I do not know if this event is for all fitness levels and ages 	A1JBSFXMMRGSQD
Am I allowed to leave the Alf Museum and come back 	I do not know if you can leave the Alf Museum and come back 	A8O98QNRG9SHV
I need to update the contact information on the account 	I do not know how to update the contact information on the account 	AD9O852KPYLHY	
Is Pacific a religious or church-related university 	I am not able to tell you if Pacific is a religious or church-related university 	A3RD486RQUI2XV
Someone stole my wallet , so now I need to cancel my credit card 	I am not able to cancel your credit card 	A8F4B0854KTXO	
What are the benefits of this insurance policy 	I do not know what the benefits of this insurance policy are 	AD9O852KPYLHY	
I was unable to attend a scheduled event ; can I get a partial refund	I do not know if you can get a partial refund since you were unable to attend a scheduled event 	A1JBSFXMMRGSQD
how long is the turn around time 	I do not know what the turn around time is	A3VV5FFG6GXE1S	
What is the deadline for buying tickets online 	I do not know the deadline for buying tickets online 	A2NI2HSU84PHJW
Can I purchase a Membership for my daycare 	I do not know if you can purchase a membership for your daycare 	A8O98QNRG9SHV
Do I have to register online 	I do not know if you have to register online 	A2NI2HSU84PHJW
do you offer a quality guarantee on all items	I do not know if we offer a guarantee on all items	AJ7MWBQFNH3E4
Will the annual salary be based on a 12 month equivalent 	I do not know if the annual salary will be based on a 12 month equivalent 	A1EG2OTSXUCY9X
Is there a car park at the Fashion Museum 	I do not know if there is a car park at the Fashion Museum 	A3I9FTHSULHPYS
Will I be penalized for paying late 	I do not know if you will be penalized for paying late 	AE9M4Z1NCYSDM	
How many department heads make up the Cabinet 	I do not know how many department heads make up the Cabinet 	A16VTK6KZ1U69H
Do you only have cars on display 	I do not know if we only have cars on display 	A325WS381BHOHH
Is there a volunteer programme 	I do not know if there is a volunteer programme 	A116N2LEI6O7HB
Can I purchase Summer tickets in Winter , and vice versa 	I do not know if you can purchase Summer tickets in Winter , and vice versa 	A3RD486RQUI2XV
How much is the Saturday delivery 	I do not know how much Saturday delivery is	APF1EAZT104LQ
How many users can I have on my account 	I do not know how many users you can have on your account 	AE9M4Z1NCYSDM	
May a health plan identifier -LRB- HPID -RRB- be used outside of HIPAA standard transactions 	I do not know if a health plan identifier -LRB- HPID -RRB- can be used outside of HIPAA standard transactions 	A2VIKCIM9TZL22
Can I bring my pet to the Zoo 	I do not know if you can bring your pet to the zoo 	A2NI2HSU84PHJW
Where are Civil Service lists used 	I do not know where the Civil Service lists are used	A23OS0HQ12VVOR
Are community property laws taken into account in determining adjusted gross income -LRB- or modified adjusted gross income -RRB- for purposes of the dependent care credit , the child tax credit , the earned income credit , and the making work pay credit 	I do not know if community property laws taken into account in determining adjusted gross income -LRB- or modified adjusted gross income -RRB- for purposes of the dependent care credit , the child tax credit , the earned income credit , and the making work pay credit 	A1J0GU26323WVA
What is family therapy and how is this coordinated	I am not able to tell you what family therapy is or how it is coordinated 	A1JBSFXMMRGSQD
Do you charge shipping by the pound or size of the box 	I do not know if we charge shipping by the pound or size of the box 	AD9O852KPYLHY	
Which animal gets the most adoptions 	I do not know which animal gets the most adoptions 	A3RD486RQUI2XV
What is the warranty period of the item I purchased 	I do not know what the warranty period of the item is 	A3VV5FFG6GXE1S	
Are international transit times always met 	I am not able to tell you if international tansit times are always met 	A116N2LEI6O7HB
How long will it be before you can tell me if I can get it in that color 	I am not able to tell you if you can get it in that color 	A31A4YKVSOYRVS	
Please make me a reservation for tomorrow 	I am not able to make a reservation for tomorrow 	A211IP73OBSU2D
Is this product made in a facility that also processes nut products 	I do not know if this product is made in a facility that also processes nut products 	A3GNQDFPZALU92	
Is there a way to set up automatic payment 	I do not know if there is a way to set up automatic payment 	A1YKWG46AWMPUX	
Do you do in-house financing 	I do not know if we do in-house financing 	AD9O852KPYLHY	
What should I do if I forgot my password	I do not know what you should do if you forgot your password 	AJNQ2PBD07FKE
What is your return policy 	I do not know our return police 	AD9O852KPYLHY	
Can my child makeup a missed class 	I do not know if your child can makeup a missed class 	A3THR2UWGQNVX4
Do you include VAT taxes for overseas shipping 	I do not know if we include VAT taxes for overseas shipping	AYJGJAIY0EXW
Does the appriser write me the check 	I am not able to tell you if the appraiser will write you a check 	A31A4YKVSOYRVS		
If I sign up for the 14-month subscription , what kind of discount do I get 	I do not know what kind of discount you would get 	A1YKWG46AWMPUX	
What are your delivery times 	I do not know what our delivery times are 	A1J0GU26323WVA
What should my child wear to dance class 	I do not know what your child should wear to dance class 	A2RHBR7XZGUI1C
Are the overalls on sale	I do not know if the overalls are on sale 	A1YKWG46AWMPUX	
How do I return something that I received as a gift	I do not know how to return something received as a gift 	A1HQRT1UG6ERGL
What times do the tour buses leave 	I do not know what times the tour buses leave 	A31A4YKVSOYRVS	
Will Cisco assist with relocation expenses 	I do not know if Cisco will assist with relocation expenses 	A3CL6GEDFNQGQY
How to reach Zoo Negara 	I do not know how to reach Zoo Negara 	A7SXWHGK8B40R
Are you open all year round 	I do not know if we are open all year round 	A1J0GU26323WVA
Please help me find a similar product but from an American owned company 	I am not able to help you find a similar product 	AMW07CJC3OJIB
How many days does it take to process my return 	I do not know how many days it takes to process your return 	ASFR82SJYMGNU
What is the cut off time for payments 	I do not know what the cut off time for payments is 	A325WS381BHOHH	
When should the value of side trips made for personal errands while using a company vehicle be included in an employee 's taxable income 	I do not know when the value of side trips using a company vehicle for personal errands should be included in an employee 's taxable income 	A1JBSFXMMRGSQD
If my order arrives broken do you issue a refund 	I do not know if we issue a refund	A23CTGXNDDW5LC	
Can I be put on a waiting list for a class that is filled 	I am not able to put you on a waiting list for a class that is filled 	A2EJ7U3TZAKROG
What do I need to know about the information I submit 	I do not know what you need to know about the information you submit 	A3RD486RQUI2XV
Where are disabled parking spaces located 	I do not know where the disabled parking spaces are located 	ARKAJ6PL85CME
Can I keep my non-grandfathered plan 	I do not know if you can keep your plan 	A13GUTDMGGZZDL
I 'd like to change my credit card info on my account 	I do not know how to change your credit card info on your account 	A185P3B2MC2K83
When/to where is the cheapest international flight right now from SFO 	I do not know when/towhere is the cheapest international flight right now from SFO	A23CTGXNDDW5LC	
How do I cancel this service 	I do not know how you cancel this service	A23CTGXNDDW5LC
Can I view the security questions that I set up 	I do not know if you can view the security questions 	A2NI2HSU84PHJW
Does the hotel offer free breakfast 	I do not know if the hotel offers free breakfast 	A1JBSFXMMRGSQD
Does anyone go in with the tigers 	I do not know if anyone goes in with the tigers 	A116N2LEI6O7HB
How do I get an additional copy of my W-2 	I do not know how you can get an additional copy of your W-2 	A355BVFIOODRH2
How much to upgrade my services 	I do not know how much it is to upgrade your services 	A31A4YKVSOYRVS	
Do you have any non toxic pool cleaning supplies 	I do not know if we have any non toxic pool cleaning supplies 	A3U6CLX7HD0SMF	
May I put my membership on hold 	I do not know if you may put your membership on hold	A23CTGXNDDW5LC
Is there an ATM at the Court 	I do not know if there is 	A1DWQO9X2ZQ35G
