Do you provide accessibility aids such as strollers , wheelchairs , hearing-assistive devices , etc. . 	I do not know if provide accessibility aids such as strollers , wheelchairs , hearing-assistive devices , etc. 	A2K9PB0U45O0MU
When will I hear back regarding the results of my application 	I do not know when you will hear back regarding the results of your application 	A2HKTM4Z8652
Want information on museum events and lectures 	I am not able to give you information on museum events and lectures 	A116N2LEI6O7HB
Does Amazon S3 offer a Service Level Agreement -LRB- SLA -RRB- 	I do not know if the Amazon S3 offers a Service Level Agreement -LRB- SLA -RRB- 	A7SXWHGK8B40R
Can I make payments in installments 	I do not know if you can make payments in installments	A23CTGXNDDW5LC	
What do you offer for groups of 10 or more 	I do not know what we offer for groups of 10 or more 	A8O98QNRG9SHV
How many paid holidays and vacation days do Fairfax County employees receive per year 	I do not know how many paid holidays and vacations days employees receive 	A325WS381BHOHH
What are the penalties for not posting a required federal poster 	I do not know the penalties for not posting a required federal poster 	A1X3SF2W1QQBY1
what is the yearly fee for this membership 	I do not know what the yearly fee for this membership is 	A31A4YKVSOYRVS	
When is the regular exhibition free of charge 	I do not know when the regular exhibition is free of charge 	A116N2LEI6O7HB
Who can I contact if I need help or special assistance in completing my application 	I do not know who you can contact if you need help or special assistance in completing your application 	A1JBSFXMMRGSQD
What do I do if I think I might be having a stroke 	I do not know what you do if you think you might be having a stroke 	A3R71HP45TBQ7O
How do I get my World smartphone ready to use outside the US 	I do not know how you get your World smartphone ready to use outside the US 	A7SXWHGK8B40R
Where can I find the instructions in spanish 	I do not know where you can find the instructions in spanish 	AD9O852KPYLHY	
My package is delayed , could I ask why 	I do not know why your package is delayed 	AD9O852KPYLHY	
Do you ship to P.O Boxes 	I do not know if we ship to P.O. boxes	AYJGJAIY0EXW
How can I get my reward 	I do not know how you can get your reward 	A2IXBTOWQRCLPZ	
What about earthquakes 	I am not able to tell you about earthquakes 	A1JBSFXMMRGSQD
Does recent action by the Georgia General Assembly regarding the asset threshold and retroactivity affect the program 	I do not know if recent action are going to affect the program	APF1EAZT104LQ
I qualified for a position in the past , but now I do n't qualify . How can that be 	I do not know how you can qualify 	A1DWQO9X2ZQ35G
How do I get to Brookfield Zoo 	I do not know how you get to the Brookfield Zoo 	A2TP3K1THK6XRB
Can I order this in purple 	I am not able to tell you if that is available in purple	APF1EAZT104LQ
Who handles shipping requests 	I do not know who handles shipping requests 	A1GAARR4GOOZCO	
Does Harvard rent facilities for non-Harvard events 	I do not know if Harvard rents facilities for non-Harvard events 	A2NI2HSU84PHJW
I like the UN Job List , what can I do to help 	I do not know what you can do to help the UN Job List 	A8O98QNRG9SHV
Can I have a refund if I need to cancel a ticket or can not come 	I do not know if you can get a refund 	A13GUTDMGGZZDL
Does the Museum appraise objects and artifacts 	I do not know if the Museum appraises objects and artifacts 	ALXPXFJ81RYE4
How many cards will I receive in the mail	I do not know how many cards you will receive 	A1F46RJTOXQM4J
Do you have a brick-and-mortar shop 	I do not know if we do 	A1DWQO9X2ZQ35G
How can I learn more about USS Constitution throughout history 	I do not know how you can learn more about the USS Constitution throughout history 	A3RD486RQUI2XV
What is Pemberton Place  , and how did it get its name 	I do not know what Pemberton Place is 	A2NI2HSU84PHJW
Show When do classes start/how many classes are there 	I am not able to show when classes start , and I do not know how many classes there are 	ARKAJ6PL85CME
Is tuition monthly or weekly 	I do not know if tuition is monthly or weekly 	A2VIKCIM9TZL22
Does Cezanne 's HR software work on Apple Macs 	I do not know if Cezanne 's HR software works on Apple Macs 	A3R71HP45TBQ7O
What benefits am I entitled to at these museums 	I do not know what benefits you 're entitled to 	A13GUTDMGGZZDL
I would like to become a member of the National Honey Board . How do I join 	I do not know how you become a member of the National Honey Board 	A3R71HP45TBQ7O
I forgot to bring my membership card ; can I still visit the zoo for Free	I do not know if you can still visit the zoo for free	A23CTGXNDDW5LC
Can you hold my order until tomorrow when I deposit my check 	I am not able to hold your order until tomorrow 	AD9O852KPYLHY	
Is The museum accessible by public transportation	I do not know if the museum is accessible by public transportation 	A2NI2HSU84PHJW
Our company uses the ' seven-minute rule ' for computing time worked -LRB- if the employee punches in at 8:08 , it is actually considered 8:15 -RRB- . This is done on both start and finish times . We are now in a situation where we have to show that this is indeed a legal way to compute time worked . Is there a Department of Labor -LRB- DOL -RRB- rule allowing this practice 	I do not know if there is a DOL rule allowing a company to use the ' seven-minute rule ' for computing time worked for start and finish times , so that you can show it is a legal way to compute time worked 	A1JBSFXMMRGSQD
Is there any restaurant or food kiosk 	I do not know if there is a restaurant or food kiosk 	A3U6CLX7HD0SMF
Do you offer benefits 	I do not know if we offer other benefits 	A3RD486RQUI2XV
Can my online ticket be applied towards a zoo membership 	I do not know if your online ticket can be applied towards a zoo membership 	A5VBIZ2KIQ1R8
What dance styles are offered at concepts Dance Studio	I do not know what dance styles are offered at Concepts Dance Studio 	A116N2LEI6O7HB
Can Cardio Dance really work as a gym replacement 	I do not know if Cardio Dance can work as a gym replacement 	A3GVKU8KSX3RZU
What are the benefits for silver membership 	I do not know what the benefits are for silver membership 	A1GAARR4GOOZCO	
Do I need to indicate my exact itinerary 	I do not know if you need to indicate your exact itinerary 	A13GUTDMGGZZDL
If I cancel service today , how long can I continue to watch Hulu 	I do not know how long you can continue to watch Hulu after you cancel your service today 	A1GAARR4GOOZCO	
Is there a drop-off location for people who want to donate books to the library 	I do not know if there is a drop-off location for people who want to donate books to the library 	A1GAARR4GOOZCO	
Do you have storage lockers 	I do not know if we have storage lockers 	A2NI2HSU84PHJW
When is payday 	I do not know when payday is 	A2ZBJWQ9ZZHYYI
What do I do about a declined payment 	I do not know what to do about a declined payment 	A2C3I4DWGVPA1O
Where is the CDC 	I do not know where the CDC is 	A2D0IIX70FDQIW
Do you have an expected ship date for my order 	I do not know if we have an expected ship date for your order 	ARCNENCVA0STW	
Where can I find more information about the Thunder Over Michigan Air Show 	I do not know where you can find more information about the Thunder Over Michigan Air Show 	A7SXWHGK8B40R
May I reproduce images from your web site 	I do not know if you are allowed to reproduce images from our web site 	A2VIKCIM9TZL22
Do you carry cherry chapstick	I do not know if we carry cherry chapstick 	A1IMXDZOTXABBE	
Do you sell gift certificates for memberships 	I do not know if we sell gift certificates for memberships	A23CTGXNDDW5LC
What is the size pants on my order	I do not know what size pants are on your order 	AE9M4Z1NCYSDM	
What happens if my order arrives and is incorrect 	I do not know what happens if your order arrives and is incorrect 	A2EAJXBORHT44T	
Do any of these clothing items come in contact with peanut products 	I do not know if any of these clothing items come in contact with peanut products 	AD9O852KPYLHY	
Can I use my smartphone battery charger instead of my sensor 's adapter 	I do not know if you can use your smartphone battery charger instead of your sensor 's adapter 	ARKAJ6PL85CME
Can I make a payment using a preloaded Visa card 	I do not know if you can make a payment using a preloaded Visa card 	A325WS381BHOHH	
How much do you charge for admission 	I do not know how much we charge for admission 	A13GUTDMGGZZDL
Do I have to be home to receive the delivery 	I do not know if you have to be home to receive the delivery 	AXY0D2AMLKE2A
What will I learn 	I do not know what you will learn 	A2NI2HSU84PHJW
How long will it take for my membership cards and package to arrive 	I do not know how long it will take for your membership cards and package to arrive 	A1J0GU26323WVA
What are the minimum technical requirements for the Minecraft : Education Edition software 	I do not know what the minimum technical requirements are for the Minecraft : Education Edition software 	A1JBSFXMMRGSQD
Where is your distribution center located 	I do not know where our distribution center is located	A23CTGXNDDW5LC
do you know when the next version of this phone will be released 	I do not know when the next version of this phone will be released 	AE9M4Z1NCYSDM	
Why are there no prices listed on anything in your store 	I do not know why there are no prices listed on anything in the store 	A1YKWG46AWMPUX	
Can See 's ship my chocolate order during the warm summer months or to warm parts of the country 	I do not know if See 's can ship your chocolate order during the warm summer months or to warm parts of the country	A3VVOQYMT73DSV
Will the benefits of my Senior Pass change 	I am not able to tell you if the benefits of your Senior Pass will change 	A1JBSFXMMRGSQD
How much are tuition fees at French universities 	I do not know how much tuition fees at French universities are 	A3RD486RQUI2XV
Why does the Museum ask visitors not to touch the art 	I do not know why the Museum asks visitors not to touch the art 	A1J0GU26323WVA
Where should an employer post notice of its email and internet policy 	I do not know where they should 	A1DWQO9X2ZQ35G
I wanted to order the software for the new tax season , when does that get released 	I do not know when the software for the new tax season will be released 	AE9M4Z1NCYSDM	
How are supporting documents -LRB- transcripts and teacher recommendations -RRB- submitted as part of my Coalition Application 	I am not able to tell you how supporting documents are submitted as part of your Coalition Application 	AT7ADQKXKXEWY
Can I bring pets or other animals to the BioPark 	I do not know if you can bring pets or other animals to the BioPark 	A3RD486RQUI2XV
Do families with multiple students get a discount 	I do not know if families with multiple students get a discount 	A3RD486RQUI2XV
Has the museum opened 	I do not know if the museum has opened 	A3I9FTHSULHPYS
How do I reserve 10 or more hotel rooms 	I do not know how you reserve 10 or more hotel rooms 	AFS36YMNN8A2J
How do I retrieve or reset my username and/or password for my online tax account 	I do not know how to retrieve or reset your username and/or password for your online tax account 	ABWW1P7GZ4C0Z
What considered excessive wear and use 	I do not know what is considered excessive wear and use 	A2NI2HSU84PHJW
Can I bring a toddler/pram on a tour/encounter	I do not know if you can bring a toddler/pram on a tour/encounter 	A3I9FTHSULHPYS
What specifically will you do to help market my book 	I do not know WHAT I WILL specifically do to help market YOUR book	ATQD23E8ESFSI
I ordered the dairy free snack subscription , but my order has chocolate in it . Is it dairy free chocolate 	I do not know if it is dairy free chocolate	APF1EAZT104LQ
How does the hiring department determine the number of applicants they wish to receive from the recruiter and can the hiring authority see all applicants 	I do not know how the hiring department determines the number of applicants they wish to receive from the recruiter or if the hiring authority can see all applicants 	A2K9PB0U45O0MU
Is there car parking in Dublin Zoo	I do not know if there is car parking in Dublin Zoo 	A2K9PB0U45O0MU
What should an employer do if an employee feels they are being bullied by a coworker on Facebook 	I do not know what an employer should do if an employee feels they are being bullied by a coworker on Facebook 	ARKAJ6PL85CME
Can I change the address I want the package to be delivered to before it ships out 	I do not know if you can change the delivered to address on the package before it ships 	A3SSJNH5SIZUPG	
Are there any rules for playing purchased Hollywood movies 	I do not know if there are any rules for playing purchased Hollywood movies 	A2D0IIX70FDQIW
May an employer ask on an application form if a candidate has any arrests or criminal convictions 	I do not know if an employer can ask on an application form if a candidate has any arrests or criminal convictions 	A3G2FBKYCRD5Q8
What courses do you offer 	I do not know what courses we offer 	A1JBSFXMMRGSQD
What Time Does In-Service Camp Start and End 	I do not know what time In-Service Camp starts and ends 	A16VTK6KZ1U69H
What are the reviews like on this product 	I am not able to tell you what the reviews are like on this product 	AE9M4Z1NCYSDM	
Do you offer tours of your factory prior to me placing an order 	I do not know if we offer tours of our factory prior to you placing an order 	AE9M4Z1NCYSDM	
Is there an age limit on claiming my child as a dependent 	I do not know if there is an age limit on claiming your child as a dependent 	A2EJ7U3TZAKROG
I need to add items to an order that has already shipped 	I am not able to add items to an order that has already shipped 	ASFR82SJYMGNU
How can I delete my account 	I do not know if you can delte your account 	A325WS381BHOHH	
Will my insurance company pay for a rental if I was in a wreck 	I do not know if your insurance company will pay for a rental if you were in a wreck 	A3SSJNH5SIZUPG	
Can you instruct me on how to do that 	I do not know how to do that 	A3DFNKXIOUFL23	
Can you tell me why my payment was declined 	I am not able to tell you why your payment was declined 	A3U6CLX7HD0SMF	
How do I know which class level to take 	I do not know which class level you should take 	A2NI2HSU84PHJW
I did not turn in my paper Form I-94 when I left the United States , what should I do 	I do not know what you should do if you did not turn in your paper Form I-94 when you left the United States 	AZLZA0Q87TJZO
What is an unrepaired safety recall 	I do not know what an unrepaired safety recall is 	A2LQ9NP944M61Z
Do you have an expedite process	I do not know if we have an expedite process	ATQD23E8ESFSI
Can I have store credit 	I do not know if you can have store credit 	AD9O852KPYLHY	
Will you match the sale price offered by another store 	I am not able to match the sale price offered by another store 	ASFR82SJYMGNU
I placed an order 2 weeks ago , can you help me see where it is 	I am not able to help you see where it is	A23CTGXNDDW5LC	
How many coupons are accepted per order 	I do not know how may coupons are accepted per order 	A1CQPRZUT6BW44
How are jurors selected for a particular trial 	I do not know how jurors are selected for a particular trial 	A2K2MFQMN31DZ
Can I choose when I receive the subscription box 	I am not able to let you choose when you receive the subscription box	APF1EAZT104LQ
Do volunteers wear uniforms 	I do not know if volunteers wear uniforms 	AZLZA0Q87TJZO
When is it necessary to have the place of accommodation notified , and how it is done 	I do not know when it is necessary to have the place of accommodation notified , or how it is done 	A3G2FBKYCRD5Q8
How much is tuition	I do not know how much tuition is 	A3G2FBKYCRD5Q8
When are you going to charge my card for my reservation 	I do not know when we are going to charge your card for your reservation 	A2K9PB0U45O0MU
I 'm Nervous to Dance , What Do I Do 	I do not know what you should do if you 're nervous to dance 	AZLZA0Q87TJZO
Can I fax it in 	I do not know if you can fax it it 	AD9O852KPYLHY	
I have injuries ... Will Barre workouts be okay for me 	I do not know if Barre workouts will be okay for you if you have injuries 	AZLZA0Q87TJZO
Besides general admission , are there other charges 	I am not able to tell you if there are other charges besides general admission 	A3RD486RQUI2XV
Please explain the return policy again 	I am not able to explain the return policy 	AD9O852KPYLHY	
Can you change my password 	I do not know if you can change your password 	A3VV5FFG6GXE1S	
I live in New York but I will be in San Francisco for the week , can I apply with your consulate for my visa	I do not know if you can apply with your consulate for your visa in San Francisco 	A1J0GU26323WVA
How soon will my items be shipped 	I do not know how soon your items will be shipped 	AE9M4Z1NCYSDM	
How do I become a Proud Member of the Gilmore Car Museum 	I do not know how you can become a Proud Member of the Gilmore Car Museum 	A30YFEIPGXNWJL
How do I request approval to file information returns electronically/magnetically 	I do not know how you request approval 	A13GUTDMGGZZDL
How are updates managed 	I do not know how updates are managed 	A7SXWHGK8B40R
How can I obtain images of works in the Museum 's collections 	I do not know how you can obtain images of works in the Museum 's collections	A3U0VQ420HIMQ0
How long does the quiz take 	I do not know how long it takes 	A1DWQO9X2ZQ35G
I want to upgrade my device , but I 'm not currently eligible . What are my options 	I do not know what your options are 	A2HKTM4Z8652
Do you offer price matching 	I do not know if we offer price matching 	A3GNQDFPZALU92	
What software is approved for IRS e-file 	I do not know what software is approved for IRS e-file	AE2QWV0TZNJAN
Who can I talk to about a rude employee 	I do not know who you can talk to about a rude employee 	AD9O852KPYLHY	
I filed electronically and my tax return was rejected . What do I do now 	I do not know what you do now that your tax return was rejected 	A3RD486RQUI2XV
What if I no longer have access to the email address associated with my account	I do not know if you have access to the email address associated with your account 	A1QX1RYLCFXZJ9
Q -- What time does the museum open and close	I do not know what time the Museum opens and closes 	A3CL6GEDFNQGQY
Does the Zoo have a dress code 	I do not know if the Zoo has a dress code 	A3RO0QIXW4IX3Y
Can my sister pick up my purchase for me 	I do not know if your sister can pick up your purchase for you 	A3GNQDFPZALU92	
I ca n't wait to visit the Zoo with my students -- how do I make this trip happen 	I do not know how you can visit the zoo with your students 	A1GNG0J27JYSUB
I need to change the credit card you bill to 	I am not able to change the credit card we bill to 	A31A4YKVSOYRVS	
Where is the Grammy Museum located 	I do not know where the Grammy Museum is located 	ABWW1P7GZ4C0Z
How long does it take for service to start 	I do not know how long it takes for service to start 	A3B1H161LQLAYP	
How are refunds typically handled if something goes wrong 	I do not know how refunds are typically handled if something goes wrong 	A3RD486RQUI2XV
What services do the film commissions provide 	I do not know what services the film commissions provide	APF1EAZT104LQ
Does the exemption apply to shipping and handling charges 	I do not know if the exemption applies to shipping and handling charges 	AZLZA0Q87TJZO
I have special cultural needs - who can I talk to 	I do not know who you can talk to 	A1JQZLDXTQ99VL
How can I customize this product I 'm interested in buying 	I am not able to customize this product 	A3GMY4693OWIRX
Can I visit the museum and go to a Pavilion Stage concert on the same day 	I do not know if you can visit the museum and go to a Pavilion Stage concert on the same day 	A2115OWJ0CKOB3
Can we leave and come back 	I do not know if you can leave and come back 	A116N2LEI6O7HB
How long does a visit take 	I do not know how long a visit takes 	A1J0GU26323WVA
Do I receive a refund if I return a day early 	I do not know if you will receive a refund if you return a day early 	A325WS381BHOHH	
Do you have ribeyes	I do not know if we have ribeyes 	A31A4YKVSOYRVS	
What should I do if someone is abusing the chat feature 	I do not know what you should do if someone is abusing the chat feature	ATQD23E8ESFSI
I 'd like to find out how many payments I have left on my order 	I am not able to tell you how many payments you have left on your order 	A31A4YKVSOYRVS	
Is it necessary for my child to dance over their summer vacation in order to advance at a typical pace 	I do not know if it necessary for your child to dance over their summer vacation in order to advance at a typical pace 	A2K9PB0U45O0MU
Are all employees entitled to earn leave 	I do not know if all employees are entitled to earn leave 	A2EJ7U3TZAKROG
Do you have a showroom 	I do not know if we have a showroom 	A3RD486RQUI2XV
Does Kirkland 's have a catalog 	I do not know if Kirkland 's has a catalog 	A3U6CLX7HD0SMF
How do I play Switch Zoo 	I do not know how you play Switch Zoo 	A13GUTDMGGZZDL
Could I receive a partial discount on my recently purchased item that came with a minor defect 	I do not know if you could recieve a partial discount 	A325WS381BHOHH	
I want to build or restore a model of USS Constitution . Do you have any plans , photographs , or other resources 	I do not know if we have any plans , photographs , or other resources to build or restore a model of USS Constitution 	A16VTK6KZ1U69H
Is there a minimum amount I have to purchase 	I do not know if there is a minimum amount you have to purchase	A23CTGXNDDW5LC
Do I have to pay an employee who reports to work 	I do not know if you have to pay an employee who reports to work 	A7SXWHGK8B40R
Can I receive a group discount on daily admission tickets online 	I do not know if you can receive a group discount on daily admission tickets online 	A2HKTM4Z8652
How do I contact the Illinois Secretary of State 	I do not know how you can contact them 	A13GUTDMGGZZDL
Will there be packing cushion in the box to avoid damage of property 	I do not know if there will be packing cushion in the box to avoid damage of property 	A9LX66EQWDRQ5	
How do I return an item that I purchased online	I do not know how to return an item purchased online 	AJ7MWBQFNH3E4
Is this product compatible with Alexa 	I do not know if this product is compatible with Alexa 	AE9M4Z1NCYSDM	
I noticed some flights are operated by other airlines and have a 24-hour hold . What does this mean 	I do not know what it means if some flights are operated by other airlines and have a 24-hour hold 	A2HKTM4Z8652
Will my UltraViolet rights expire 	I do not know if your UltraViolet rights will expire 	A1JBSFXMMRGSQD
Do you have parking on the premises 	I do not know if there is parking on the premises	A3NHJPE6326P9V
What do I do if someone has accessed my account without my permission 	I do not know what you should do if someone has accessed your account without your permission 	A325WS381BHOHH	
Is it possible to include a gift message with the gift I have purchased 	I am not able to tell you if it is possible to include a gift message with the gift you have purchased	AYJGJAIY0EXW
Can I get this printed in a larger size 	I do not know if you can get this printed in a larger size 	A3B1H161LQLAYP	
How do you Volunteer 	I do not know how you Volunteer 	A3I9FTHSULHPYS
Can I place my order by mail , instead of online 	I do not know if you can place your order by mail instead of online 	A8F4B0854KTXO	
Does an employer that provides a nondiscretionary bonus to meet the salary level threshold for the Fair Labor Standards Act -LRB- FLSA -RRB- overtime exemptions have any obligations towards an employee who leaves in the middle of a quarter 	I do not know if an employer that provides a nondiscretionary bonus to meet the salary level threshold for the Fair Labor Standards Act -LRB- FLSA -RRB- overtime exemptions has any obligations towards an employee who leaves in the middle of a quarter 	APC99TPURUHR8
What should I do before I go to court 	I do not know what you should do before you go to court 	A7SXWHGK8B40R
Is Marwell open all year round 	I do not know if Marwell is open all year round 	A1XNCA1SVTT15B
If I signed up for a class but ca n't attend , will I be charged 	I do not know if you will be charged if you signed up for a class but ca n't attend 	A2LQ9NP944M61Z
I 'd like to speak with a manager about this order I 've been waiting for two weeks for 	I am not able to get you a manager to speak to 	AJNQ2PBD07FKE
Do you have senior or military discounts on memberships 	I am not able to let you know if we offer military discounts on memberships 	A3SS1F4F3JE7CU
What sorts of warranties do you offer	I do not know what sorts of warranties we offer	A23CTGXNDDW5LC
How many product lines do you offer 	I do not know how many product lines we offer 	A31A4YKVSOYRVS	
Can I order this product online later 	I do not know if you can order this product online later 	A3RD486RQUI2XV
What levels/phases do you teach 	I do not know what levels and phrases we teach 	A9LX66EQWDRQ5
How long did it take to put the collection together	I am not able to tell you how long it took to put the collection together 	AL7UTA8J27TFK
What is the difference between pre-location scouting and location scouting 	I do not know what the difference between pre-location scouting and location scouting is 	APC99TPURUHR8
Can I get a refund of the application fee I paid 	I do not know if you can get a refund of the application fee you paid 	A7SXWHGK8B40R
