Is my eye glass prescription still on file 	I do not know if your eye glass prescription is still on file 	A31A4YKVSOYRVS	
Can I make custom orders for things that are n't in your catalog 	I do not know if you can custom order items from our catalog 	AJNQ2PBD07FKE
I place an order three weeks ago and still have not received it . Can you check to find out why 	I am not able to check why you have n't received your order yet 	A1F04SJJSSWA1N
can i change my shipping preference to expedited shipping	I am not able to change your shipping preference to expedited shipping 	A31A4YKVSOYRVS	
Can I take an earlier tour if I arrive early 	I do not know if you can take an earlier tour if you arrive early 	A7SXWHGK8B40R
Is there any way that I can get two copies of my receipt 	I do not know if there is any way that you can get two copies of your receipt 	A1J0GU26323WVA	
I just got an email that says my item was ' Out of Stock ' . What are my options 	I do not know what your options are if you got an email that says your item was ' Out of Stock ' 	A1JBSFXMMRGSQD
What coupons are available for my order 	I do not know what coupons are available for your order 	ASFR82SJYMGNU
Will I have to pay additional registration fees when I pick up my plate 	I do not know if you will have to pay additional registration fees when you pick up your plate 	A2VIKCIM9TZL22
Can I get some extra padding for this new shipment 	I am not able to provide extra padding for this shipment 	A1D9EH4NAAP40N
How can I get photographic prints or slides of Museum images 	I do not know how you can get photographic prints or slides of museum images 	A2NI2HSU84PHJW
Will you be ordering any additional colors of this item 	I do not know if I will be ordering any additional colors 	A113OGTB578EF6	
What is the difference between the debt and the deficit 	I do not know the difference between them 	A2NI2HSU84PHJW
I 'd like to rent the car for the long weekend - does the deal start on Friday or Saturday 	I do not know if the deal starts Friday or Saturday 	AJNQ2PBD07FKE
How long are print-at-home tickets valid 	I do not know how long print-at-home tickets are valid 	A16VTK6KZ1U69H
What is the NRC 	I do not know what the NRC is 	A13JQTLPWXZD6L
How much more expensive is the new model than last year 's model 	I do not know how much more expensive he new model is than last year 's model 	A325WS381BHOHH	
Is it normal for hamsters to have their teeth sometimes fall off 	I do not know if it is normal for a hamster 's teeth to fall out 	A3DFNKXIOUFL23
My package never arrived and it 's past the date - can you check on it 	I am not able to check on it	A23CTGXNDDW5LC
Can I return this to any store 	I do not know if you can return this to any store 	ASFR82SJYMGNU
Why should I outsource my HR 	I do not know why you should outsource your HR 	A2115OWJ0CKOB3
How often should I apply 	I do not know how often you should apply 	A2NI2HSU84PHJW
How long will this item be on sale 	I do not know how long the item will be on sale 	A3U6CLX7HD0SMF	
Who should I contact if I need assistance completing the online application 	I do not know who you should contact if you need assistance completing the online application 	A7SXWHGK8B40R
Does your company have a direct contact for the courier 	I do not know if our company has a direct contact for the courier 	A9LX66EQWDRQ5	
Are photographs allowed 	I do not know if photographs are allowed 	A3RD486RQUI2XV
Will I be allowed to change the size of my race singlet during the race entry pack collection -LRB- REPC -RRB-	I do not know if you are allowed to change the size of your race singlet during the race entry pack collection 	A9LX66EQWDRQ5
I would like to make a new account for a different card I 'm using 	I am not able to assist you in making a new account for a different card 	A2PKDWREQV1JTR
Do I have to fly to earn MileagePlus miles 	I do not know if you have to fly to earn MileagePlus miles 	A9LX66EQWDRQ5
What all does my policy include 	I do not know what your policy includes 	AE9M4Z1NCYSDM	
How do I apply for a State job 	I do not know how you apply for a State job 	A20WRVVT7WQFT7
Will my employees feel like they work for someone else 	I do not know if your employees feel like they work for someone else 	A14M2EERU7E8KD
How long do I have to issue an employee their final check 	I do not know how long you have to issue an employee their final check 	A13GUTDMGGZZDL
When does a private lesson package expire	I do not know when a private lesson package expires 	A7SXWHGK8B40R
How can I change my password for My Verizon 	I do not know how you can change your password for My Verizon 	A355BVFIOODRH2
How long does it take to receive a permanent membership card and my membership materials after I send in payment 	I do not know how long it takes to receive a permanent membership card and your membership materials after you send in payment 	A2K9PB0U45O0MU
How many different financial options do you have available 	I do not know how many different financial options we have available 	A31A4YKVSOYRVS	
How do I make a reservation for a class	I do not know how you make a reservation for a class 	A3SS1F4F3JE7CU
When will my order ship 	I do not know when your order ship 	AE9M4Z1NCYSDM	
Are group discounts available 	I do not know if group discounts are available 	A2HKTM4Z8652
If i order today , when can I expect my order to be guaranteed to be delivered 	I do not know when you can expect your order 	A1YKWG46AWMPUX	
What is AgFunder 	I do not know what AgFunder is 	A8O98QNRG9SHV
how often do new items get released 	I do not know how often new items get released 	A31A4YKVSOYRVS	
When does an employer have to comply with the Affordable Care Act 's Form W-2 health care reporting requirement 	I do not know when 	A1DWQO9X2ZQ35G
Where are the butterflies 	I do not know where the butterflies are 	APC99TPURUHR8
How much does it cost to get my dog spayed 	I do not know how much it costs to get your dog spayed 	AE9M4Z1NCYSDM	
What can I call my company 	I do not know what you can call your company 	A1S8DYWNS59XWB
How to reach the museum 	I do not know how to reach the museum 	A7SXWHGK8B40R
Can I do work experience at Chester Zoo 	I do not know if you can do work experience at Chester Zoo 	A9LX66EQWDRQ5
Can we bring in a picnic lunch 	I do not know if you can bring in a picnic lunch 	A3I9FTHSULHPYS
Can I have leather seats installed in this vehicle 	I do not know if you can have leather seats installed in this vehicle 	A9LX66EQWDRQ5	
Can you check on my account for me 	I am not able to check on your account for you 	AE9M4Z1NCYSDM	
If I bought this item at one store location , can I return it at another 	I do not know if you can return this item at another store location 	A3GNQDFPZALU92	
How do I get a copy of my maintenance contract or a list of machines covered under maintenance or warranty 	I do not know how you get a copy of your maintenance contract or a list of machines covered under maintenance or warranty 	A1S8DYWNS59XWB
How do I arrange for a group of adults or students to visit 	I do not know how to arrange for a group of adults or students to visit 	A2K9PB0U45O0MU
When is the Museum closed 	I do not know when the musuem is closed 	A13GUTDMGGZZDL
I have a disability , how can I participate in the testing process 	I do not know how you can participate in the testing process 	A2K2MFQMN31DZ
How can I find information on your intern program 	I do not know how you can find information on our intern program 	A3RD486RQUI2XV
How much do I have left to pay for my new phone 	I do not know how much you have left to pay for your new phone 	A3GNQDFPZALU92	
How do I add an additional appointment located at a different campus 	I do not know how to add an additional appointment located at a different campus 	A3NZLRU95OULXB
Do you offer membership options 	I do not know if we offer memebership options 	A1J0GU26323WVA
Could you help me find a prom dress for my daughter 	I am not able to help you find a prom dress for your daughter 	A3VV5FFG6GXE1S	
Do we still have affirmative action goals 	I do not know if you still have affirmative action goals 	A325WS381BHOHH
Why was my visa application rejected even though a Certificate of Eligibility was issued 	I do not know why your visa application was rejected even though a Certificate of Eligibility was issued 	A16VTK6KZ1U69H
How can I complain about poor medical care I received in a hospital 	I do not know how you can complain about poor medical care you received in a hospital 	A2TP3K1THK6XRB
What are Reporter 's Transcript Deposit Costs 	I do not know what this is 	A2NI2HSU84PHJW
Can I bring a stroller in the Museum 	I do not know if you can bring a stroller in the Museum	A3NHJPE6326P9V
Can I rent a stroller 	I do not know if you can rent a stroller 	A1JBSFXMMRGSQD
Can you tell me about any promotional plans you offer	I am not able to tell you about any promotional plans we offer 	A1JBSFXMMRGSQD
Can I plan an educational visit for my school class or home school group 	I do not know if you can plan an educational visit for your school class or home school group	A23CTGXNDDW5LC
Who determines when a position is properly designated as security/safety sensitive and/or CAAL-covered 	I do not know who determines when a position is properly designated as security/safety sensitive and/or CAAL-covered 	A2K2MFQMN31DZ
Can I purchase a photograph of an object in the Museum collection 	I do not know if you purchase a photograph of an object in the Museum collection 	A18KR781AUQBA6
How do I hold a special event at one of the Carnegie Museums of Pittsburgh 	I do not know how you can hold a special event at one of the Carnegie Museums of Pittsburgh 	A1XNCA1SVTT15B
How often do large whales calve 	I do not know how often large whales calve 	A2NI2HSU84PHJW
What kind of fabric do you offer for outdoor cushions 	I do not know what kind of fabric we offer for outdoor cushions 	A31A4YKVSOYRVS	
How is the diameter of Lodge cookware determined 	I do not know how the diameter of Lodge cook ware is determined 	A2K9PB0U45O0MU
What happens if my card is lost or stolen 	I do not know what happens if your card is lost or stolen 	A3CL6GEDFNQGQY
How much recovery time is needed after the lasik eye surgery 	I do not know how much recovery time is needed after the lasik eye surgery 	A31A4YKVSOYRVS	
Can I lose weight with this product 	I do not know if you can lose weight with this product	A23CTGXNDDW5LC
Is there an account manager I can speak to 	I do not know if there is an account manager you can speak to 	ASFR82SJYMGNU
Can you cancel my shipment 	I am not able to cancel your shipment 	A1YKWG46AWMPUX	
Can I check my account balance 	I do not know if you can check your account balance 	AD9O852KPYLHY	
What is the Berlin Document Center 	I do not know what the Berlin Document Center is 	A1JQZLDXTQ99VL
Will we have to wait	I do not know if you will have to wait 	A1J0GU26323WVA
Does FIT offer tuition reimbursement for other SUNY colleges 	I do not know if FIT offers tuition reimbursement for other SUNY colleges 	A2NI2HSU84PHJW
Is it easy to learn	I do not know if it is easy to learn 	A298FAWY76NZA9
Can we build our own HR reports 	I do not know if you can build your own HR reports 	A3G2FBKYCRD5Q8
Do you have any sulfate-free shampoos 	I do not know if we have any sulfate-free shampoos 	AE9M4Z1NCYSDM	
Why should you book Bucket Fillers , Inc. for a presentation 	I do not know why we should book Bucket Fillers , Inc. for a presentation 	A2VIKCIM9TZL22
Am I using my Voice plan 's minutes when I access the Mobile Web 	I do not know if you use your voice plan 's minutes when you access the mobile web 	A8O98QNRG9SHV
I forgot to pack something . Where can I purchase essential items 	I do not know where you can purchase essential items 	A3VSBRD9GN89I2
Where may I nurse my child 	I do not know where you may nurse your child 	A3SS1F4F3JE7CU
When are applications due 	I do not know when applications are due 	A3NZLRU95OULXB
Can you help me pick between product A and product B 	I am not able to help you pick 	A1YKWG46AWMPUX	
How do I upgrade my room 	I do not know how you can upgrade your room 	A2VIKCIM9TZL22
What is the Museum 's cancellation policy for events 	I do not know the Museum 's cancellation policy for events 	A7SXWHGK8B40R
How much does it cost to rent this car for one day 	I do not know how much it costs to rent this car for one day 	A9LX66EQWDRQ5	
Just how much ground coffee do I need for x amount of coffee 	I do not know how much ground coffee do you need for x amount of coffee 	A3SS1F4F3JE7CU
Why was I charged sales tax on my order when I should be tax exempt 	I do not know why you were chared sales tax 	A2K2MFQMN31DZ
Why are some images so blurry 	I do not know why some images are so blurry 	A3U6CLX7HD0SMF
Is it possible to arrange a guided group visit to the Anne Frank House 	I do not know if it is possible to arrange a guided group visit 	A325WS381BHOHH
Where do I get the UT Austin Selective Service Eligibility and Verification Form 	I do not know where you get the UT Austin Selective Service Eligibility and Verification Form 	A3RD486RQUI2XV
Is that a bargain	I do not know if that is a bargain 	A113OGTB578EF6	
What if we need to cancel 	I am not able to cancel 	A3RKYD8IUC5S0N
Can I ship international with you 	I do not know if you can ship international 	AD9O852KPYLHY	
Can I make a post sale adjustment 	I do not know if you can make a post sale adjustment 	A3GNQDFPZALU92	
Is it possible for non-Japanese to purchase Value Fare and Basic Fare discount tickets 	I do not know if it is possible for non-Japanese to purchase Value Fare and Basic Fare discount tickets 	A1JBSFXMMRGSQD
Can I take pictures of the artworks I see 	I do not know if you can take pictures of the artworks you see 	A2UBEPT605E8T2
What if I have questions about using ESS or wish to offer some feedback 	I am not able to help if you have questions about using ESS or wish to offer some feedback 	A1JBSFXMMRGSQD
To do business with HR Alternatives is there a long term contract required 	I do not know if there is a long term contract required to do business with HR Alternatives 	A16VTK6KZ1U69H
When does CIBTvisas apply ' rush ' and 'em ergency ' fee surcharges for passport processing 	I am not able to access information for passport processing 	A2K9PB0U45O0MU
What is a Uniform Schengen Visa 	I do not know what a Uniform Schengen Visa is 	A10249252O9I20MRSOBVF
Could you help me figure out what is wrong with my car 	I am not able to help you figure out what is wrong with your car	A23CTGXNDDW5LC	
How long do pointe shoes last 	I do not know how long pointe shoes last 	A3UJE4WA5XADZS
Does the court appoint a lawyer to represent me 	I do not know if the court will appoint a lawyer to represent you 	A1J0GU26323WVA
Can you please help me change my password 	I am not able to help you change your password 	AD9O852KPYLHY	
Who is eligible for Student pricing 	I do not know who is eligible for Student pricing 	A3U6CLX7HD0SMF
My program requires that I pass a state professional licensing exam and/or obtain a professional board certification before I can work in the state . How will the closure of ITT impact my ability to sit for my exam or obtain professional certification 	I do not know how the closure of ITT will impact your ability to set for your exam or obtain professional certification 	A2NI2HSU84PHJW
Do you guys offer repair services for items 	I do not know if we offer repair services for items	A23CTGXNDDW5LC
Is flash photography allowed 	I do not know if flash photography is allowed 	A3RO0QIXW4IX3Y
How can I find the zoo 	I do not know how you can find the zoo 	A2K9PB0U45O0MU
Did you make a recent change to PINs and passwords 	I do not know if we have made a recent change to PINS and passwords 	A116N2LEI6O7HB
Can I buy tickets online 	I do not know if you can buy tickets online 	A13GUTDMGGZZDL
How Can I Keep Up With Museum Exhibitions , Programs , And Events 	I do not know how you can keep up with museum exhibitions , programs , and events	A23CTGXNDDW5LC
What is the difference between the guest pass and the ' guest of ' card 	I do not know what the difference between the guest pass and the ' guest of ' card is 	A16VTK6KZ1U69H
Could you help me discontinue my service 	I am not able to help you discontinue your service 	A31A4YKVSOYRVS	
What are the key things we should look at 	I do not know what the key things are that you should look at 	AZLZA0Q87TJZO
Why do you need my phone number 	I do not know why your phone number is needed 	A2NI2HSU84PHJW
When is this due 	I do not know when it is due 	A1YKWG46AWMPUX	
Does the new product line have any new features 	I do not know if the new product line has any new features 	A260AFDCSXBQOH
Tell me when I 'll be able to see the changes made to my order 	I am not able to see changes made to your order 	AJNQ2PBD07FKE
Why is a Hospitalist Caring for me Instead of my Regular Doctor 	I do not know why the Hospitalist is caring for you rather then your Regular Doctor 	A2VIKCIM9TZL22
What do I need to do after completing booking 	I do not know what to do after you complete booking 	A2115OWJ0CKOB3
I see a charge on my card that I do n't recall making - can you tell me what it was for 	I am not able to tell you what it was for	A23CTGXNDDW5LC
Should I apply for financing directly with Chase or at a dealership 	I do not know if you should apply for financing directly with Chase or at a dealership 	A1JBSFXMMRGSQD
What sales do you guys have around the autumn 	I do not know what sales we have around autumn 	A185P3B2MC2K83
Will we be able to pet any of the animals 	I do not know if you will be able to pet any of the animals 	A3I9FTHSULHPYS
May an employer claim a larger tip credit for overtime hours 	I do not know if an employer can claim a larger tip for overtime hours 	APF1EAZT104LQ
When a provider signs up for Electronic Funds Transfer -LRB- EFT -RRB- with a health plan to allow money to be deposited into the provider 's account , does that arrangement also allow a health plan to deduct money from the provider 's account 	I do not know if a provider signs up for Electronic Funds Transfer -LRB- EFT -RRB- with a health plan to allow money to be deposited into the provider 's account , if that arrangement also allow a health plan to deduct money from the provider 's account 	A3RD486RQUI2XV
What is the WSECU - Inspired Learning for All - Initiative 	I do not know what the WSECU - Inspired Learning for All - Initiative is 	A1JBSFXMMRGSQD
How do I join or renew my membership 	I do not know how you join or renew your membership 	A3U6CLX7HD0SMF
Where is CHIPSA and how do I arrive at the medical facilities 	I do not know where CHIPSA is or how you arrive at the medical facilities 	A3U0VQ420HIMQ0
Could you clean this car better , please 	I am not able to clean your car better 	A3SSJNH5SIZUPG	
I have been diagnosed with kidney disease . Can I have a list of foods that are high in phosphorus 	I am not able to give you a list of foods that are high in phosphorus 	A7SXWHGK8B40R
Can I make a change to my shipping details 	I do not know if you can make a change to your shipping details	AYJGJAIY0EXW
What should be included in my work contract 	I do not know what should be included in your contract 	A13GUTDMGGZZDL
What is the fee for expedited shipping 	I do not know what the fee is for expedited shipping 	A9LX66EQWDRQ5	
I got an email about this product this morning , but it 's already sold out , is it possible to backorder 	I do not know if it is possible to backorder 	ASFR82SJYMGNU
My account name has changed . Do I need to request a new MileagePlus card 	I do not know if you need to request a new MileagePlus card 	AT7ADQKXKXEWY
Can you close my account 	I am not able to close your account 	AE9M4Z1NCYSDM	
How can I tell if my resume is still active in the Duke system 	I do not know if your resume is still active in the Duke system 	A3B2YRXL26RPVH
Can I change my court date 	I do not know if you can change your court date 	A1199EKUWHAKUQ
Will you present a Zoo on Wheels birthday party at my child 's school 	I do not know if we will present a Zoo on Wheels birthday party at your child 's school 	A7SXWHGK8B40R
Can you tell me how much expedited shipping would cost 	I am not able to tell you how much expedited shipping would cost 	A8F4B0854KTXO	
How do I change my User ID for My Verizon 	I do not know how you change your user id for My Verizon	A23CTGXNDDW5LC
What MARTA route comes to the Aquarium 	I do not know what MARTA route comes to the Aquarium 	A3B2YRXL26RPVH
How much of a nutrient is too much 	I do not know how much of a nutrient is too much 	A7SXWHGK8B40R
How far in advance do I need to book 	I do not know how far in advance you need to book 	A16NITTBMCSN0V
What options are available for customer service 	I do not know what options are available for customer service 	A260AFDCSXBQOH
How do I know which size I should be ordering	I do not know what size you should be ordering 	A1HQRT1UG6ERGL
I need to add a user to my account 	I am not able to add a user to your account	A23CTGXNDDW5LC	
When can I expect to get billed 	I do not know when you should expect to get billed 	AJNQ2PBD07FKE
How can I visit the Treasure Gallery 	I do not know how you can 	A1DWQO9X2ZQ35G
What are the ramifications of an employer 's failure to post the required Family and Medical Leave Act -LRB- FMLA -RRB- notice 	I do not know what the ramifications of an employer 's failure to post the required FMLA notices are 	A2NI2HSU84PHJW
What if the card does n't work 	I do not know what happens if the card does n't work 	A1JBSFXMMRGSQD
Is there a user manual or online help available to assist users with Time Collection inquiries and issues 	I do not know if there is online help or a user manual for Time Collection inquiries and issues 	A3NZLRU95OULXB
Is smoking allowed in the Zoo 	I do not know if smoking is allowed in the Zoo 	A2HKTM4Z8652
Can I see a copy of my labor contract 	I am not able to show you a copy of your labor contract 	A1JBSFXMMRGSQD
How old is this building 	I do not know how old this building is 	AT7ADQKXKXEWY
What is a combination class 	I do not know what combination class is 	A2UBEPT605E8T2
I think I was overcharged last month	I do not know if you were overcharged last month 	A9LX66EQWDRQ5	
If an employee is fired unexpectedly , how can the employer satisfy state law requiring the employer to pay the employee immediately 	I do not know how the employer can satisfy state law requiring the employer to pay the employee immediately if the employee is fired unexpectedly 	A1J0GU26323WVA
Does the Mob Museum offer group pricing or special event options 	I do not know if the Mob Museum offers group pricing or special event options 	A2D0IIX70FDQIW
I want to change ym password to my account . How do I do that 	I am not able to change the password to your account 	AE9M4Z1NCYSDM	
What 's wrong with a jailbroken or rooted device 	I do not know what 's wrong with a jailbroken or rooted device	ATQD23E8ESFSI
I used the wrong card to buy this today , can I transfer that purchase to another card 	I am not able to transfer that purchase to another card 	A1YKWG46AWMPUX	
Is there something I can print at home that I can present to my recipient while I wait to receive the voucher/personalized membership 	I do not know if there is something you can print at home that you can present to the recipient while you wait to receive the voucher/personalized membership 	A2NI2HSU84PHJW
Do you offer meat in more than one fat content percentage 	I do not know if we offer meat in more than one fat content percentage 	A9LX66EQWDRQ5	
If a farm park decides to display wild boar does it require a zoo licence 	I do not know if a zoo license is required if a farm park decides to display wild boar 	A2HKTM4Z8652
Why is n't The Very Hungry Caterpillar on exhibit 	I do not know why The Very Hungry Caterpillar is n't on exhibit 	A3B2YRXL26RPVH
There are so many schools in the U.S. . How do I decide which schools to apply to 	I do not know why there are so many schools in the US . I am not able to help you decide which ones you should apply to 	A1F46RJTOXQM4J
How to get proof of retirement or pension income 	I do not know how you would get proof of retirement or pension income 	A13GUTDMGGZZDL
What Are the Camp 's Food Policies 	I do not know the camp 's food policies 	ADDRUVU9CWJTG
How long does it take for an EEA national to receive a registration certificate , and for how long the residence certificate is valid 	I do not know how long it takes for an EEA national to receive a registration certificate , or how long the residence certificate is valid 	A234VIHHUHPZG5
Who will be impacted by the change 	I do not know who will be impacted by the change 	A2TP3K1THK6XRB
I want to bring my pet , do any hotels accept pets 	I do not know if any hotels accept pets 	A16VTK6KZ1U69H
Are there any fees associated with backdating my account under The Verizon Plan 	I do not know if there are any associated fees with backdating your account under The Verizon Plan 	A2NI2HSU84PHJW
When is my due date 	I do not know when your due date is 	A325WS381BHOHH	
How do I tell if my computer can run a 64-bit version of Windows 	I am not able to tell if your computer can run a 64-bit version of Windows 	A1IMICF9ISISZN
Do I need to give a privacy notice to everyone who walks into my showroom 	I do not know if you need to give a privacy notice to everyone who walks in your showroom 	A1S0R9UMW0FWAZ
Do you offer any discounts or know of any funding available for presentations 	I do not know if we offer any discounts or have funding available for presentations 	A1J0GU26323WVA
Is it necessary to make a reservation in advance 	I do not know if it is necessary to make a reservation in advance 	A1XNCA1SVTT15B
Looks like I received the wrong size for the clothing I ordered last week 	I do not know of you received the wrong size of clothing	APF1EAZT104LQ
